{
  "schemaVersion": 1,
  "kind": "ReferrerObserved",
  "recordedAt": "2026-09-19T11:42:46Z",
  "source": {
    "type": "github-actions",
    "workflow": "promote from quarantine / quarantine/python",
    "runUrl": "https://github.com/toddysm/cssc-framework/actions/runs/35440827419",
    "runId": "35440827419",
    "runAttempt": "1"
  },
  "occurrence": {
    "registry": "ghcr.io",
    "repository": "toddysm/golden/python"
  },
  "subject": {
    "digest": "sha256:739bf1348daec881719fe4d45fc4d6e891ff032a858cbbd9382a9a3cdfffe308",
    "tag": "sha256-870c3f16f98c916c1c2e2d84c7036fdf8fe901611abc2096cd2c59e71868fbc9"
  },
  "referrer": {
    "digest": "sha256:a374363465fb6440d3ccf29e5a0b0107f0b508e8d2e20956799ab8772b6a7cec",
    "artifactType": "application/vnd.in-toto+json"
  },
  "observedAt": "2026-09-19T11:42:46Z",
  "id": "sha256:b3a4195545b3df418fc2f74e627295b1bbc717ea5147002e848e6850fb03714e"
}
