{
  "schemaVersion": 1,
  "kind": "ReferrerObserved",
  "recordedAt": "2026-08-25T06:21:36Z",
  "source": {
    "type": "github-actions",
    "workflow": "mirror / quarantine/python",
    "runUrl": "https://github.com/toddysm/cssc-framework/actions/runs/32816568923",
    "runId": "32816568923",
    "runAttempt": "1"
  },
  "occurrence": {
    "registry": "ghcr.io",
    "repository": "toddysm/quarantine/python"
  },
  "subject": {
    "digest": "sha256:8a14a31f4bf634c04722154f30eb33998b4068de8b83b6b2800ec1b7238555d0",
    "tag": "3.14-slim"
  },
  "referrer": {
    "digest": "sha256:fe45fca001c0e3309682cbe7639fa127c458a44a243589465633d437ddfb18ad",
    "artifactType": "application/vnd.in-toto+json"
  },
  "observedAt": "2026-08-25T06:21:36Z",
  "id": "sha256:f0ca637a035293f4f355ddd34b4abdbbffb12563c26a0fcb74f549ad2a59659d"
}
