{
  "schemaVersion": 1,
  "kind": "ReferrerObserved",
  "recordedAt": "2026-10-09T13:59:12Z",
  "source": {
    "type": "github-actions",
    "workflow": "promote from quarantine / quarantine/python",
    "runUrl": "https://github.com/toddysm/cssc-framework/actions/runs/37940745907",
    "runId": "37940745907",
    "runAttempt": "1"
  },
  "occurrence": {
    "registry": "ghcr.io",
    "repository": "toddysm/golden/python"
  },
  "subject": {
    "digest": "sha256:b44a3f56280a1fbcc888edb07a2aa1befc3b62e951b3363743ad99b9c55064d0",
    "tag": "sha256-9d2a631d044769963ee27e56ed1d2de1adf64f108529e3d2de7d829cb2967806"
  },
  "referrer": {
    "digest": "sha256:863849a84ae8b3ab5bd586bcd08c706cdc9d35b324d7f5c0fc8492ba459c165f",
    "artifactType": "application/vnd.in-toto+json"
  },
  "observedAt": "2026-10-09T13:59:12Z",
  "id": "sha256:14e4ac8ba96c23bda46781030c7cfa65e4108d7a83eb2cce08ca8c85d27b0b21"
}
