{
  "schemaVersion": 1,
  "kind": "ReferrerObserved",
  "recordedAt": "2026-10-22T12:37:13Z",
  "source": {
    "type": "github-actions",
    "workflow": "promote from quarantine / quarantine/python",
    "runUrl": "https://github.com/toddysm/cssc-framework/actions/runs/39779738787",
    "runId": "39779738787",
    "runAttempt": "1"
  },
  "occurrence": {
    "registry": "ghcr.io",
    "repository": "toddysm/golden/python"
  },
  "subject": {
    "digest": "sha256:c160a3a7acbc87e9a0f132d76971468d02749fb7fad0a3a0c58643ead83d37c3",
    "tag": "sha256-0514bc76712d64f8bb48adcb95b1ab0d88c69fee95d62fe4c18ee948bee9b1e1"
  },
  "referrer": {
    "digest": "sha256:7d57fd54a15a3e0ccea8a6f16757f67400c8c35cb7f00101039cf2f8eb120bc9",
    "artifactType": "application/vnd.in-toto+json"
  },
  "observedAt": "2026-10-22T12:37:13Z",
  "id": "sha256:02f48375012f413e1f2a8b2365b875ad6aa3fb6f430589f73a6a97e670b90819"
}
