{
  "schemaVersion": 1,
  "kind": "ReferrerObserved",
  "recordedAt": "2026-09-23T12:30:19Z",
  "source": {
    "type": "github-actions",
    "workflow": "promote from quarantine / quarantine/node",
    "runUrl": "https://github.com/toddysm/cssc-framework/actions/runs/35860808145",
    "runId": "35860808145",
    "runAttempt": "1"
  },
  "occurrence": {
    "registry": "ghcr.io",
    "repository": "toddysm/base/node"
  },
  "subject": {
    "digest": "sha256:036c1e3985574469ac358eed180290bafa3441046230fc57809518817dd8cd71",
    "tag": "sha256-b341ca66519d9a1c25d4e41f254ffb6fe403fc0f9054c62b863f0660dcc1c199"
  },
  "referrer": {
    "digest": "sha256:544234f513f0070d4ce6cbb218f1cfdb378dcbd35f27ff4f1c7e30d28d8649e4",
    "artifactType": "application/vnd.in-toto+json"
  },
  "observedAt": "2026-09-23T12:30:19Z",
  "id": "sha256:e5af912f18287b8933ed22049dad4f375916fbabc1b220cd1cf54f0e72b22959"
}
