{
  "schemaVersion": 1,
  "kind": "ReferrerObserved",
  "recordedAt": "2026-08-28T19:12:20Z",
  "source": {
    "type": "github-actions",
    "workflow": "promote from quarantine / quarantine/node",
    "runUrl": "https://github.com/toddysm/cssc-framework/actions/runs/33202768341",
    "runId": "33202768341",
    "runAttempt": "1"
  },
  "occurrence": {
    "registry": "ghcr.io",
    "repository": "toddysm/base/node"
  },
  "subject": {
    "digest": "sha256:76f88adc68c7b3a3fed1b7573deda4eb5a2133e6977bec108ba4024420474c53",
    "tag": "sha256-0d642590166d10420a0efa32b0db56987aef75eeca82742305b4ac4cfd0210e0"
  },
  "referrer": {
    "digest": "sha256:e9e71e9fc8494623dd3d26ebc685759f7cc1c74fbc2840bc7b5d9df877078036",
    "artifactType": "application/vnd.in-toto+json"
  },
  "observedAt": "2026-08-28T19:12:20Z",
  "id": "sha256:ec20c6850964a3dea5fc1e25815ba985439c93d608ac90f438e76ce32d440ee1"
}
