{
  "schemaVersion": 1,
  "kind": "ReferrerObserved",
  "recordedAt": "2026-09-26T10:20:50Z",
  "source": {
    "type": "github-actions",
    "workflow": "mirror / quarantine/python",
    "runUrl": "https://github.com/toddysm/cssc-framework/actions/runs/36235479432",
    "runId": "36235479432",
    "runAttempt": "1"
  },
  "occurrence": {
    "registry": "ghcr.io",
    "repository": "toddysm/quarantine/python"
  },
  "subject": {
    "digest": "sha256:51dafde81dbdb6ebde285137a295cf18a47ca95234fe388a343719cb97305b3d",
    "tag": "3.14-slim"
  },
  "referrer": {
    "digest": "sha256:caf0514d942546ca48855891bebd0fb116c9c1e4cd0e148a08a73cb68359b515",
    "artifactType": "application/vnd.in-toto+json"
  },
  "observedAt": "2026-09-26T10:20:50Z",
  "id": "sha256:e1d39a9b808348993eeee04fcee0b6dc566b6dbb887011725b82e33b5e109557"
}
