{
  "schemaVersion": 1,
  "kind": "ReferrerObserved",
  "recordedAt": "2026-08-26T07:37:25Z",
  "source": {
    "type": "github-actions",
    "workflow": "promote from quarantine / quarantine/python",
    "runUrl": "https://github.com/toddysm/cssc-framework/actions/runs/32943620203",
    "runId": "32943620203",
    "runAttempt": "1"
  },
  "occurrence": {
    "registry": "ghcr.io",
    "repository": "toddysm/golden/python"
  },
  "subject": {
    "digest": "sha256:11edba29dd86e3946bae154c78de15203d230e7ff6b81c915c25f176294542cc",
    "tag": "sha256-145ee7a57727c5ec47a1ef5e9e78b774c3873f845f2f5d61d0658e0f38234b40"
  },
  "referrer": {
    "digest": "sha256:e53840770a5300ad578fbf0fce190dcc086723320e0ee83ab2151813f0f35a0b",
    "artifactType": "application/vnd.in-toto+json"
  },
  "observedAt": "2026-08-26T07:37:25Z",
  "id": "sha256:a99dd110b12d284543c834eb258e7326e6b3a4809ac7ec3ae6db31cfa37009f4"
}
