{
  "schemaVersion": 1,
  "kind": "ReferrerObserved",
  "recordedAt": "2026-09-26T11:56:49Z",
  "source": {
    "type": "github-actions",
    "workflow": "promote from quarantine / quarantine/python",
    "runUrl": "https://github.com/toddysm/cssc-framework/actions/runs/36240360886",
    "runId": "36240360886",
    "runAttempt": "1"
  },
  "occurrence": {
    "registry": "ghcr.io",
    "repository": "toddysm/golden/python"
  },
  "subject": {
    "digest": "sha256:0427727c9757abc639c204eebcfafaf8169c5f19fc2e1fed5c89499b7d89f2c9",
    "tag": "sha256-1e27ec3180ae8e80e0fd9d49ac3a42948d32c617c33e4587b924c9479ca8f0c6"
  },
  "referrer": {
    "digest": "sha256:a8563e83ae36d0fa420f21552e104347a68e376c64534b0ef84a21b069305cb1",
    "artifactType": "application/vnd.in-toto+json"
  },
  "observedAt": "2026-09-26T11:56:49Z",
  "id": "sha256:64cbd935edc2bd1fd17d060b83770700d3708dbb51bf8bae0b6f838cf484882f"
}
